{
  "_comment": "CAT12 Statistics Pipeline Configuration - Study Specific",
  "_updated": "2026-02-01",
  
  "study": {
    "name": "Default Study",
    "description": "CAT12 statistical analysis configuration"
  },

  "software": {
    "mode": "matlab",
    "_mode_options": "matlab or standalone"
  },

  "matlab": {
    "executable": "/Applications/MATLAB_R2025b.app/bin/matlab",
    "allow_graphics": false,
    "_comment_exe": "macOS: /Applications/MATLAB_R*.app/bin/matlab | Linux: /usr/local/MATLAB/R*/bin/matlab | Leave empty for auto-detect"
  },

  "spm": {
    "path": "/Volumes/Evo/software/spm25/",
    "_comment": "Optional - auto-detected if not specified"
  },

  "python": {
    "executable": "python3",
    "_comment": "Usually 'python3' or full path if not in PATH"
  },

  "analysis": {
    "_participants_file": "/Volumes/Thunder/129_PK01/cat12/stats/results/data/orig_participants.tsv",
    "participants_file": "/Volumes/Thunder/129_PK01/cat12/stats/results/data/participants_intervention_control.tsv",
    "group_column": "group",
    "session_column": "session",
    "sessions": ["1", "2", "3"],
    "_sessions_options": "Use ['all'] or specific list like ['1', '2', '3']",
    "group_labels": {
      "intervention": "Running group",
      "control": "Control"
    },
    "_group_labels_comment": "Human-readable labels for groups; keys match values in group_column",
    "standardize_continuous": true,
    "_comment": "Define modalities below; each can have different smoothing, covariates, masks",
    
    "modalities": [
      { 
        "name": "vbm",
        "folder_name": "vbm_9mm_2G_3TP_tiv_sex_age_test",
        "smoothing_kernel": null,
        "_smoothing_comment": "null for auto-detect (must be single kernel)",
        "covariates": ["tiv", "sex", "age"],
        "mask": "/Volumes/Thunder/129_PK01/cat12/stats/templates/brainmask_GMtight.nii"
      }
    ]
  },

  "screening": {
    "uncorrected_p": 0.001,
    "cluster_size_voxels": 10,
    "skip_screening": false
  },

  "tfce": {
    "enabled": false,
    "n_permutations": 1000,
    "pilot_mode": false,
    "_pilot_permutations": "Use 100 for quick testing"
  },

  "double_threshold": {
    "enabled": true,
    "intensity_p_uncorrected": 0.001,
    "cluster_size_voxels": 10,
    "fwe_level": 0.05,
    "spm_defaults": "FMRI",
    "_comment": "Double threshold: intensity p-value (uncorrected), min cluster size voxels, and FWE correction level for multiple comparisons"
  },

  "reporting": {
    "enabled": true,
    "auto_generate": true,
    "_auto_generate_comment": "Automatically generate HTML report after statistics",
    "quality": "low",
    "_quality_options": "low (fast), standard (balanced), publication (high-res)",
    "filter": "double_threshold",
    "_filter_options": "all, tfce, no_tfce, spmt, double_threshold",
    "output_filename": "report_{date}.html",
    "_output_comment": "Use {date} for YYYY-MM-DD, {modality} for modality name, {analysis} for analysis_name",
    "thresholds": [
      {"p_value": 0.01, "label": "Significant (p < 0.01)"},
      {"p_value": 0.05, "label": "Significant (p < 0.05)"},
      {"p_value": 0.1, "label": "Trend (p < 0.1)"}
    ],
    "_thresholds_note": "Specify p-value thresholds; log_p is computed internally as -log10(p)"
  },

  "performance": {
    "parallel_jobs": 1,
    "memory_limit_gb": 8
  },

  "output": {
    "analysis_name": "2groups_3sessions",
    "force_clean": true
  }
}
